{
  "claim_id": "OEP-27-2849",
  "policy_limit": 2950.00,
  "claimed_amount": 3031.00,
  "covered_amount": 2329.00,
  "excluded_amount": 702.00,
  "held_amount": 0.00,
  "approved_amount": 2329.00,
  "disposition": "approved",
  "route": "auto_approve",
  "gate_score": 100,
  "eligible_for_stp": true,
  "decision_lines": [
    {
      "source_index": 0,
      "description": "Prior occupancy balance",
      "category": "occupancy_balance",
      "status": "covered",
      "claimed_amount": 1380.00,
      "covered_amount": 1380.00,
      "excluded_amount": 0.00,
      "held_amount": 0.00,
      "approved_amount": 1380.00
    },
    {
      "source_index": 1,
      "description": "Reletting interval — 21 days at $73.00 per day",
      "category": "reletting_gap",
      "status": "partially_covered",
      "claimed_amount": 1533.00,
      "covered_amount": 949.00,
      "excluded_amount": 584.00,
      "held_amount": 0.00,
      "approved_amount": 949.00
    },
    {
      "source_index": 2,
      "description": "Vendor scheduling charge",
      "category": "operator_fee",
      "status": "excluded",
      "claimed_amount": 118.00,
      "covered_amount": 0.00,
      "excluded_amount": 118.00,
      "held_amount": 0.00,
      "approved_amount": 0.00
    }
  ]
}
