{
  "claim_id": "OEP-27-2146",
  "policy_limit": 2410.00,
  "claimed_amount": 2955.00,
  "covered_amount": 2852.00,
  "excluded_amount": 103.00,
  "held_amount": 0.00,
  "approved_amount": 2410.00,
  "disposition": "approved",
  "route": "auto_approve",
  "gate_score": 100,
  "eligible_for_stp": true,
  "notes": {
    "cap": "Policy limit binds. Covered amount $2,852 exceeds limit $2,410. Greedy cap allocation in source order."
  },
  "decision_lines": [
    {
      "source_index": 0,
      "description": "Patio-door glazing replacement",
      "category": "unit_restoration",
      "status": "covered",
      "claimed_amount": 916.00,
      "covered_amount": 916.00,
      "excluded_amount": 0.00,
      "held_amount": 0.00,
      "approved_amount": 916.00
    },
    {
      "source_index": 1,
      "description": "Kitchen cabinet-face restoration",
      "category": "unit_restoration",
      "status": "covered",
      "claimed_amount": 842.00,
      "covered_amount": 842.00,
      "excluded_amount": 0.00,
      "held_amount": 0.00,
      "approved_amount": 842.00
    },
    {
      "source_index": 2,
      "description": "Entry floor restoration",
      "category": "unit_restoration",
      "status": "covered",
      "claimed_amount": 1094.00,
      "covered_amount": 1094.00,
      "excluded_amount": 0.00,
      "held_amount": 0.00,
      "approved_amount": 652.00
    },
    {
      "source_index": 3,
      "description": "Processing charge",
      "category": "operator_fee",
      "status": "excluded",
      "claimed_amount": 103.00,
      "covered_amount": 0.00,
      "excluded_amount": 103.00,
      "held_amount": 0.00,
      "approved_amount": 0.00
    }
  ]
}
