{
  "claim_id": "OEP-27-6795",
  "policy_limit": 3190.00,
  "claimed_amount": 5292.00,
  "covered_amount": 2556.00,
  "excluded_amount": 2736.00,
  "held_amount": 0.00,
  "approved_amount": 2556.00,
  "disposition": "approved",
  "route": "auto_approve",
  "gate_score": 100,
  "eligible_for_stp": true,
  "notes": {
    "recovery": "$683 post-closeout recovery applied once, greedy in source order. Line-level recovery attribution is convention, not ground truth. Case totals are firm."
  },
  "decision_lines": [
    {
      "source_index": 0,
      "description": "Primary wall and trim restoration",
      "category": "unit_restoration",
      "status": "covered",
      "claimed_amount": 1944.00,
      "covered_amount": 1261.00,
      "excluded_amount": 683.00,
      "held_amount": 0.00,
      "approved_amount": 1261.00
    },
    {
      "source_index": 1,
      "description": "Reletting interval — 11 days at $69.00 per day",
      "category": "reletting_gap",
      "status": "covered",
      "claimed_amount": 759.00,
      "covered_amount": 759.00,
      "excluded_amount": 0.00,
      "held_amount": 0.00,
      "approved_amount": 759.00
    },
    {
      "source_index": 2,
      "description": "Primary wall and trim restoration",
      "category": "unit_restoration",
      "status": "excluded",
      "claimed_amount": 1944.00,
      "covered_amount": 0.00,
      "excluded_amount": 1944.00,
      "held_amount": 0.00,
      "approved_amount": 0.00
    },
    {
      "source_index": 3,
      "description": "Posted restoration supplement",
      "category": "unit_restoration",
      "status": "covered",
      "claimed_amount": 536.00,
      "covered_amount": 536.00,
      "excluded_amount": 0.00,
      "held_amount": 0.00,
      "approved_amount": 536.00
    },
    {
      "source_index": 4,
      "description": "Late amendment charge",
      "category": "operator_fee",
      "status": "excluded",
      "claimed_amount": 109.00,
      "covered_amount": 0.00,
      "excluded_amount": 109.00,
      "held_amount": 0.00,
      "approved_amount": 0.00
    }
  ]
}
