{
  "claim_id": "OEP-27-8150",
  "policy_limit": 3265.00,
  "claimed_amount": 2726.00,
  "covered_amount": 958.00,
  "excluded_amount": 1768.00,
  "held_amount": 0.00,
  "approved_amount": 958.00,
  "disposition": "approved",
  "route": "auto_approve",
  "gate_score": 100,
  "eligible_for_stp": true,
  "decision_lines": [
    {
      "source_index": 0,
      "description": "Carpet replacement",
      "category": "unit_restoration",
      "status": "excluded",
      "claimed_amount": 1075.00,
      "covered_amount": 0.00,
      "excluded_amount": 1075.00,
      "held_amount": 0.00,
      "approved_amount": 0.00
    },
    {
      "source_index": 1,
      "description": "Window treatment replacement",
      "category": "unit_restoration",
      "status": "excluded",
      "claimed_amount": 438.00,
      "covered_amount": 0.00,
      "excluded_amount": 438.00,
      "held_amount": 0.00,
      "approved_amount": 0.00
    },
    {
      "source_index": 2,
      "description": "Life-safety work",
      "category": "unit_restoration",
      "status": "covered",
      "claimed_amount": 606.00,
      "covered_amount": 606.00,
      "excluded_amount": 0.00,
      "held_amount": 0.00,
      "approved_amount": 606.00
    },
    {
      "source_index": 3,
      "description": "Door closer replacement",
      "category": "unit_restoration",
      "status": "partially_covered",
      "claimed_amount": 528.00,
      "covered_amount": 352.00,
      "excluded_amount": 176.00,
      "held_amount": 0.00,
      "approved_amount": 352.00
    },
    {
      "source_index": 4,
      "description": "Closeout handling charge",
      "category": "operator_fee",
      "status": "excluded",
      "claimed_amount": 79.00,
      "covered_amount": 0.00,
      "excluded_amount": 79.00,
      "held_amount": 0.00,
      "approved_amount": 0.00
    }
  ]
}
